{
  "schema_version": 1,
  "scene_id": "libhand_adult_textured_habitat_visual_scale_v1",
  "description": "Diagnostic visual-only adult-sized LibHand mesh (~90 mm breadth, ~198 mm length) using the same physical stimulus protocol and Poly Haven habitat; textured sensor material.",
  "units": "m",
  "coordinate_system": {
    "handedness": "right",
    "up_axis": "+Z",
    "forward_axis": "+X"
  },
  "asset_root": "/data/models/3d/malecns-gpu",
  "materials": {
    "table_worn_wood": {
      "base_color_rgba": [
        0.3753,
        0.2636,
        0.1157,
        1.0
      ],
      "description": "Mean diffuse-texture RGB used as flat sensor albedo; Blender replay retains the linked texture."
    },
    "apple_skin": {
      "base_color_rgba": [
        0.3539,
        0.1298,
        0.0323,
        1.0
      ],
      "description": "Mean diffuse-texture RGB used as flat sensor albedo; Blender replay retains the linked texture."
    },
    "plant_pot": {
      "base_color_rgba": [
        0.6089,
        0.43,
        0.2995,
        1.0
      ],
      "description": "Mean diffuse-texture RGB used as flat sensor albedo; Blender replay retains the linked texture."
    },
    "plant_leaves": {
      "base_color_rgba": [
        0.2483,
        0.2853,
        0.1494,
        1.0
      ],
      "description": "Mean diffuse-texture RGB used as flat sensor albedo; Blender replay retains the linked texture."
    },
    "hand_skin_texture": {
      "base_color_rgba": [
        1.0,
        1.0,
        1.0,
        1.0
      ],
      "sensor_texture_mode": "triangle_centroid",
      "description": "Bilinear 2K photo-albedo sampling at each hand triangle centroid; 4K pore normal is retained for Blender display."
    }
  },
  "assets": [
    {
      "object_id": "environment_table",
      "path": "polyhaven/WoodenTable_01/WoodenTable_01_1k.gltf",
      "role": "visual",
      "semantic_role": "table",
      "transform": {
        "translation_m": [
          0.0,
          0.0,
          -0.5487492250442505
        ],
        "rotation_xyzw": [
          0.0,
          0.0,
          0.0,
          1.0
        ],
        "scale": 1.0
      },
      "asset_unit_scale_to_m": 1.0,
      "material_refs": {
        "WoodenTable_01": "table_worn_wood"
      },
      "integrity": {
        "sha256": "413804e054055c397b4cfbd0916027097d2a20853b165b533007a46d131e1d17",
        "files": {
          "WoodenTable_01.bin": "1083a3442969d27e18e6a7a454bc164407439e3908bf8f17f5fb24d58cd0172e",
          "textures/WoodenTable_01_arm_1k.jpg": "ad876f814215006d35f74670d4fc14a9f6eab386a9307764521449464a1cd6ef",
          "textures/WoodenTable_01_diff_1k.jpg": "9535de577ad6b64deb68457af14240dd9b6d82143da0b6d2bf337660ebd855f3",
          "textures/WoodenTable_01_nor_gl_1k.jpg": "330655534ea1fc7c7387b5d2ba5ca3231711a9fa680b980933a3a9c82cdb1c67"
        }
      },
      "provenance": {
        "source": "Poly Haven WoodenTable_01",
        "source_url": "https://polyhaven.com/a/WoodenTable_01",
        "license": "CC0",
        "exporter": "Poly Haven glTF 2.0 distribution",
        "export_settings": {
          "resolution": "1k",
          "format": "glTF 2.0"
        }
      }
    },
    {
      "object_id": "food_apple",
      "path": "polyhaven/food_apple_01/food_apple_01_1k.gltf",
      "role": "visual",
      "semantic_role": "food_target",
      "transform": {
        "translation_m": [
          -0.62,
          -0.19,
          0.0
        ],
        "rotation_xyzw": [
          0.0,
          0.0,
          0.0,
          1.0
        ],
        "scale": 1.0
      },
      "asset_unit_scale_to_m": 1.0,
      "material_refs": {
        "food_apple_01": "apple_skin"
      },
      "integrity": {
        "sha256": "6a7dc1cda1271c8b08e36e2b9fd44371b7149cca6262c71bc36d971cdac4325f",
        "files": {
          "food_apple_01.bin": "f14ff9647fdd9f5a59ef325f94154e91f1f14cc2563cd3fb572c4fe9ce5756ca",
          "textures/food_apple_01_diff_1k.jpg": "b7fc17cfb5013958167bbc089ea4d1c193fb1c61ea4f3c974a9894ed9ba82e8a",
          "textures/food_apple_01_nor_gl_1k.jpg": "c81b1e51ce7e789b65bfde2f046dcb5ba5773b5c6be3e572313be0600c51721b",
          "textures/food_apple_01_rough_1k.jpg": "2e5a503af38df7b570b0e81cc9563125f0913b466e01140d4e24ea5ebdbec587"
        }
      },
      "provenance": {
        "source": "Poly Haven food_apple_01",
        "source_url": "https://polyhaven.com/a/food_apple_01",
        "license": "CC0",
        "exporter": "Poly Haven glTF 2.0 distribution",
        "export_settings": {
          "resolution": "1k",
          "format": "glTF 2.0"
        }
      }
    },
    {
      "object_id": "potted_plant",
      "path": "polyhaven/potted_plant_01/potted_plant_01_1k.gltf",
      "role": "visual",
      "semantic_role": "potted_plant",
      "transform": {
        "translation_m": [
          0.55,
          0.18,
          0.0
        ],
        "rotation_xyzw": [
          0.0,
          0.0,
          0.0,
          1.0
        ],
        "scale": 0.35
      },
      "asset_unit_scale_to_m": 1.0,
      "material_refs": {
        "potted_plant_01_pot": "plant_pot",
        "potted_plant_01_leaves": "plant_leaves"
      },
      "integrity": {
        "sha256": "23b30294407684b02f14800d6685bd8938da5d2111e17753ac8dd3c37d8c88a0",
        "files": {
          "potted_plant_01.bin": "a8dd1f7ce75f50dc25bbedc20809da02ee4193815c155b883a329925fa5548f7",
          "textures/potted_plant_01_leaves_diff_1k.jpg": "b73891a0a606e139d0fcdd9e6fe503cd1210be3fc9c55fbd033941288231ccaa",
          "textures/potted_plant_01_leaves_nor_gl_1k.jpg": "2faa756e0ee2b8341c752b283b93599157bf56f4083a9f61b825cdfa0c7138ff",
          "textures/potted_plant_01_leaves_rough_1k.jpg": "765e3bd1bfdad39dd0d1cd755eafd1f9f1d46cbbb6013988cbfd1197de27a1f9",
          "textures/potted_plant_01_pot_diff_1k.jpg": "51c9d80e8abe585bd3dbcebe7cba1d3ed1a22b137c7cb66baf0e462c08dca312",
          "textures/potted_plant_01_pot_nor_gl_1k.jpg": "ec02e51751e0822d229d48bea1373b06e2675c3725ff04fd1f87ac516719e620",
          "textures/potted_plant_01_pot_rough_1k.jpg": "1256199fe3a88a0534bcd4c8bf141cfa9a28b68fce3f286193d0713796fd8561"
        }
      },
      "provenance": {
        "source": "Poly Haven potted_plant_01",
        "source_url": "https://polyhaven.com/a/potted_plant_01",
        "license": "CC0",
        "exporter": "Poly Haven glTF 2.0 distribution",
        "export_settings": {
          "resolution": "1k",
          "format": "glTF 2.0"
        }
      }
    },
    {
      "object_id": "libhand_open_palm",
      "path": "libhand/0.9/normalized/libhand_open_palm.glb",
      "role": "visual",
      "semantic_role": "palm",
      "transform": {
        "translation_m": [
          0.0,
          0.0,
          0.0
        ],
        "rotation_xyzw": [
          0.0,
          0.0,
          0.0,
          1.0
        ],
        "scale": [
          1.0,
          2.196052521590846,
          2.196052521590846
        ]
      },
      "asset_unit_scale_to_m": 1.0,
      "material_refs": {
        "skin": "hand_skin_texture"
      },
      "integrity": {
        "sha256": "6ba1bc50246e469dc0ce004e003c305cd2853da2ba07f28e02cbbb9493905e9f",
        "files": {}
      },
      "provenance": {
        "source": "LibHand v0.9 hand model by Marin Saric, designed by Rizzle Studios",
        "source_url": "https://www.libhand.org/download.html",
        "source_archive_sha256": "dad21d2cf170652368bacd584422fe5b4d52f349c6f411d2b546904bfd25d671",
        "license": "CC BY 3.0",
        "license_url": "https://www.libhand.org/license.html",
        "exporter": "Blender 5.2.2 via scripts/prepare_libhand_palm.py",
        "export_settings": {
          "format": "glTF 2.0 GLB",
          "albedo_px": [
            2048,
            2048
          ],
          "procedural_pore_normal_px": [
            4096,
            4096
          ],
          "embedded_images": true
        },
        "visual_scale_diagnostic": "Visual mesh Y/Z enlarged to adult-like 90 mm breadth; X depth remains 20 mm; physical stimulus kinematics and proxy size metadata unchanged."
      }
    }
  ],
  "replay": {
    "bindings": {
      "fly_object_id": null,
      "stimulus_object_ids": {
        "palm_looming_grounded": "libhand_open_palm"
      }
    },
    "camera": {
      "mode": "chase",
      "focal_length_mm": 85,
      "follow_distance_m": 0.02,
      "height_m": 0.03,
      "look_ahead_m": 0.06
    },
    "context_camera": {
      "mode": "scene_overview",
      "focal_length_mm": 35,
      "exposure_ev": -1.0,
      "follow_distance_m": 3.0,
      "height_m": 1.0,
      "look_ahead_m": 0.6
    },
    "lighting": {
      "hdri_path": "polyhaven/hdri/small_empty_room_4_1k.hdr",
      "hdri_sha256": "56e1bd966a28b225b36705f9357e891eb8c7302c9800a12bba0abe38b760788f",
      "world_strength": 0.35,
      "key_type": "AREA",
      "key_power_w": 80,
      "key_size_m": 1.2
    }
  },
  "simulation": {
    "stimulus_object_ids": {
      "palm_looming_grounded": "libhand_open_palm"
    }
  }
}
